user_input,retrieved_contexts,response,reference
Which magazine was started first Arthur's Magazine or First for Women?,"[""Title: First for Women\nFirst for Women is a woman's magazine published by Bauer Media Group in the USA.\n The magazine was started in 1989.\n It is based in Englewood Cliffs, New Jersey.\n In 2011 the circulation of the magazine was 1,310,696 copies."", 'Title: Arthur\'s Magazine\nArthur\'s Magazine (1844–1846) was an American literary periodical published in Philadelphia in the 19th century.\n Edited by T.S. Arthur, it featured work by Edgar A. Poe, J.H. Ingraham, Sarah Josepha Hale, Thomas G. Spear, and others.\n In May 1846 it was merged into ""Godey\'s Lady\'s Book"".']","Arthur's Magazine was started first, in 1844, while First for Women was started in 1989.",Arthur's Magazine
The Oberoi family is part of a hotel company that has a head office in what city?,"['Title: The Oberoi Group\nThe Oberoi Group is a hotel company with its head office in Delhi.\n Founded in 1934, the company owns and/or operates 30+ luxury hotels and two river cruise ships in six countries, primarily under its Oberoi Hotels & Resorts and Trident Hotels brands.', 'Title: Oberoi family\nThe Oberoi family is an Indian family that is famous for its involvement in hotels, namely through The Oberoi Group.']","The Oberoi family is part of The Oberoi Group, which has its head office in Delhi.",Delhi
"Musician and satirist Allie Goertz wrote a song about the ""The Simpsons"" character Milhouse, who Matt Groening named after who?","['Title: Milhouse Van Houten\nMilhouse Mussolini van Houten is a fictional character featured in the animated television series ""The Simpsons"", voiced by Pamela Hayden, and created by Matt Groening who named the character after President Richard Nixon\'s middle name.\n Later in the series, it is revealed that Milhouse\'s middle name is ""Mussolini.""', 'Title: Allie Goertz\nAllison Beth ""Allie"" Goertz (born March 2, 1991) is an American musician.\n Goertz is known for her satirical songs based on various pop culture topics.\n Her videos are posted on YouTube under the name of Cossbysweater.\n Subjects of her songs have included the film ""The Room"", the character Milhouse from the television show ""The Simpsons"", and the game Dungeons & Dragons.\n Her style has been compared to that of Bo Burnham.\n In December 2015, Goertz released a concept album based on the Adult Swim series ""Rick and Morty"", ""Sad Dance Songs"", with the album\'s cover emulating the animation and logo of the series.\n The album was made possible through Kickstarter.\n She is co-host of Everything\'s Coming Up Podcast, a Simpsons-focused podcast along with Julia Prescott.']",Matt Groening named the character Milhouse after President Richard Nixon's middle name.,President Richard Nixon
 What nationality was James Henry Miller's wife?,"['Title: June Miller\nJune Miller (January 7 or 28, 1902 – February 1, 1979) was the much-written-about second wife of Henry Miller.', 'Title: Jim Miller (Australian footballer, born 1919)\nJames Henry Miller (born 30 May 1919) is a former Australian rules footballer in the Victorian Football League (VFL).']",The context provided does not give information about the nationality of James Henry Miller's wife.,American
"Cadmium Chloride is slightly soluble in this chemical, it is also called what?","['Title: Cadmium chloride\nCadmium chloride is a white crystalline compound of cadmium and chlorine, with the formula CdCl.\n It is a hygroscopic solid that is highly soluble in water and slightly soluble in alcohol.\n Although it is considered to be ionic, it has considerable covalent character to its bonding.\n The crystal structure of cadmium chloride (described below), composed of two-dimensional layers of ions, is a reference for describing other crystal structures.\n Also known are CdCl•HO and CdCl•5HO.', 'Title: Gold(III) chloride\nGold(III) chloride, traditionally called auric chloride, is a chemical compound of gold and chlorine.\n With the molecular formula AuCl, the name gold trichloride is a simplification, referring to the empirical formula, AuCl.\n The Roman numerals in the name indicate that the gold has an oxidation state of +3, which is common for gold compounds.\n There is also another related chloride of gold, gold(I) chloride (AuCl).\n Chloroauric acid, HAuCl, the product formed when gold dissolves in aqua regia, is sometimes referred to as ""gold chloride"" or ""acid gold trichloride"".\n Gold(III) chloride is very hygroscopic and highly soluble in water as well as ethanol.\n It decomposes above 160\xa0°C or in light.']",Cadmium chloride is slightly soluble in alcohol.,alcohol
